[
  {
    "first_published_at": "2025-01-25T03:00:00+08:00",
    "id": "media-0001",
    "item_count": 355,
    "last_published_at": "2026-10-27T00:14:59+08:00",
    "media_bytes": 1122092343,
    "repository": "chenshaorong0118/jaychou-instagram-archive-media-0001",
    "sealed": false,
    "sealed_commit": null
  }
]
